{
  "version": 1,
  "id": "high-contrast-dark",
  "name": "High contrast dark",
  "mode": "dark",
  "colors": {
    "bg": "#000000",
    "bg-secondary": "#000000",
    "bg-elevated": "#000000",
    "bg-hover": "#202020",
    "border": "#ffffff",
    "text": "#ffffff",
    "text-strong": "#ffffff",
    "text-muted": "#eeeeee",
    "text-faint": "#dddddd",
    "accent": "#ffff00",
    "accent-text": "#000000",
    "accent-dim": "#262600",
    "selection": "#464600",
    "highlight-bg": "#ffff00",
    "highlight-text": "#000000",
    "code": "#ffffff",
    "h1": "#ffffff",
    "h2": "#ffff00",
    "h3": "#80ffff",
    "h4": "#ffffff",
    "aff": "#80dfff",
    "neg": "#ffb3c1",
    "aff-bg": "#00151e",
    "neg-bg": "#200009",
    "danger": "#ffb3c1",
    "warning": "#ffff00",
    "shadow": "#ffffff40",
    "backdrop": "#000000cc"
  }
}