{
  "version": 1,
  "id": "dark",
  "name": "Dark",
  "mode": "dark",
  "colors": {
    "bg": "#1e1e1e", "bg-secondary": "#161616", "bg-elevated": "#262626",
    "bg-hover": "#2c2c2c", "border": "#333333", "text": "#dcddde",
    "text-strong": "#f2f2f2", "text-muted": "#a0a0a0", "text-faint": "#929292",
    "accent": "#8b6cff", "accent-text": "#ffffff", "accent-dim": "#8b6cff40",
    "selection": "#8b6cff59", "highlight-bg": "#3d8f3d", "highlight-text": "#ffffff",
    "code": "#e6a26a", "h1": "#f2f2f2", "h2": "#c9b8ff",
    "h3": "#9fd3ff", "h4": "#ffd479", "aff": "#5aa9ff", "neg": "#ff6b6b",
    "aff-bg": "#5aa9ff12", "neg-bg": "#ff6b6b12", "danger": "#ff6b6b",
    "warning": "#f0b429", "shadow": "#00000080", "backdrop": "#00000073"
  }
}
