{
  "version": 1,
  "id": "high-contrast-light",
  "name": "High contrast light",
  "mode": "light",
  "colors": {
    "bg": "#ffffff", "bg-secondary": "#ffffff", "bg-elevated": "#ffffff",
    "bg-hover": "#eeeeee", "border": "#000000", "text": "#000000",
    "text-strong": "#000000", "text-muted": "#202020", "text-faint": "#303030",
    "accent": "#000080", "accent-text": "#ffffff", "accent-dim": "#e3e3ff",
    "selection": "#c9c9ff", "highlight-bg": "#000000", "highlight-text": "#ffffff",
    "code": "#000000", "h1": "#000000", "h2": "#000080",
    "h3": "#003050", "h4": "#000000", "aff": "#003066", "neg": "#65001a",
    "aff-bg": "#edf6ff", "neg-bg": "#fff0f4", "danger": "#65001a",
    "warning": "#503000", "shadow": "#00000080", "backdrop": "#00000099"
  }
}
